{
  "schema": "sp.signal_surface_catalog.v1",
  "catalog_id": "sp.catalog.github.signals.default",
  "catalog_version": "1.0.0",
  "surfaces": [
    {
      "surface": "github.issue.title",
      "trust_tier": "untrusted"
    },
    {
      "surface": "github.issue.comment",
      "trust_tier": "untrusted"
    },
    {
      "surface": "github.pull_request.diff",
      "trust_tier": "constrained"
    },
    {
      "surface": "github.workflow_dispatch.inputs",
      "trust_tier": "constrained"
    },
    {
      "surface": "github.repo_file.protected",
      "trust_tier": "trusted"
    },
    {
      "surface": "github.release.metadata",
      "trust_tier": "constrained"
    }
  ]
}
